{
  "schedule_id": "exec_m11_provider_key_drift",
  "profile": "idempotent-replay",
  "mutant_id": "exec_m11",
  "events": [
    {
      "id": "capture-timeout-replay",
      "kind": "request",
      "actor": "svc-a",
      "request": {
        "request_id": "capture-timeout-replay",
        "identity": {
          "tenant": "merchant-1",
          "operation_type": "capture",
          "parent_resource": "auth-m11",
          "caller_key": "m11-key",
          "epoch": 0
        },
        "payload": {
          "amount": 100,
          "currency": "USD"
        },
        "require_effect": true
      },
      "behavior": "commit_drop_reply"
    }
  ]
}
