{
  "schedule_id": "exec_m9_short_retention",
  "profile": "idempotent-replay",
  "mutant_id": "exec_m9",
  "events": [
    {
      "id": "capture-retained",
      "kind": "request",
      "actor": "svc-a",
      "request": {
        "request_id": "capture-retained",
        "identity": {
          "tenant": "merchant-1",
          "operation_type": "capture",
          "parent_resource": "auth-m9",
          "caller_key": "m9-key",
          "epoch": 0
        },
        "payload": {
          "amount": 100,
          "currency": "USD"
        },
        "require_effect": true
      },
      "behavior": "commit_reply"
    },
    {
      "id": "advance-within-promised-window",
      "kind": "advance_time",
      "advance_by": 20
    }
  ]
}
