{
  "schedule_id": "exec_m2_unknown_as_rejected",
  "profile": "opaque-provider",
  "mutant_id": "exec_m2",
  "events": [
    {
      "id": "opaque-timeout",
      "kind": "request",
      "actor": "svc-a",
      "request": {
        "request_id": "opaque-timeout",
        "identity": {
          "tenant": "merchant-1",
          "operation_type": "capture",
          "parent_resource": "auth-m2",
          "caller_key": "m2-key",
          "epoch": 0
        },
        "payload": {
          "amount": 100,
          "currency": "USD"
        },
        "require_effect": true
      },
      "behavior": "commit_drop_reply"
    }
  ]
}
