{
  "schedule_id": "safe_pair_03_unknown_outcome_opaque_provider",
  "profile": "opaque-provider",
  "mutant_id": "safe",
  "events": [
    {
      "id": "capture-timeout",
      "kind": "request",
      "actor": "svc-a",
      "behavior": "commit_drop_reply",
      "request": {
        "request_id": "safe_pair_03_unknown_outcome_opaque_provider_capture-timeout",
        "identity": {
          "tenant": "merchant-1",
          "operation_type": "capture",
          "parent_resource": "auth-opaque",
          "caller_key": "opaque-key",
          "epoch": 0
        },
        "payload": {
          "amount": 100,
          "currency": "USD"
        },
        "require_effect": true
      }
    }
  ]
}
