{
  "schedule_id": "exec_m5_loser_calls_provider",
  "profile": "idempotent-replay",
  "mutant_id": "exec_m5",
  "events": [
    {
      "id": "attempt-a",
      "kind": "request",
      "actor": "svc-a",
      "request": {
        "request_id": "attempt-a",
        "identity": {
          "tenant": "merchant-1",
          "operation_type": "capture",
          "parent_resource": "auth-race",
          "caller_key": "same-key",
          "epoch": 0
        },
        "payload": {
          "amount": 100,
          "currency": "USD"
        },
        "require_effect": true
      },
      "behavior": "commit_reply"
    },
    {
      "id": "attempt-b",
      "kind": "request",
      "actor": "svc-b",
      "request": {
        "request_id": "attempt-b",
        "identity": {
          "tenant": "merchant-1",
          "operation_type": "capture",
          "parent_resource": "auth-race",
          "caller_key": "same-key",
          "epoch": 0
        },
        "payload": {
          "amount": 100,
          "currency": "USD"
        },
        "require_effect": true
      },
      "behavior": "commit_reply"
    }
  ]
}
