{
  "schedule_id": "changed_payload_all_states",
  "profile": "idempotent-replay",
  "mutant_id": "safe",
  "events": [
    {
      "id": "capture-1",
      "kind": "request",
      "actor": "svc-a",
      "behavior": "commit_reply",
      "request": {
        "request_id": "capture-1",
        "identity": {
          "tenant": "merchant-1",
          "operation_type": "capture",
          "parent_resource": "auth-1",
          "caller_key": "capture-key",
          "epoch": 0
        },
        "payload": {
          "amount": 100,
          "currency": "USD"
        },
        "require_effect": true
      }
    },
    {
      "id": "capture-2",
      "kind": "request",
      "actor": "svc-a",
      "behavior": "commit_reply",
      "request": {
        "request_id": "capture-2",
        "identity": {
          "tenant": "merchant-1",
          "operation_type": "capture",
          "parent_resource": "auth-1",
          "caller_key": "capture-key",
          "epoch": 0
        },
        "payload": {
          "amount": 101,
          "currency": "USD"
        },
        "require_effect": true
      }
    }
  ]
}
